{
  "schemaVersion": 1,
  "taskId": "R14-ROUND",
  "producer": "project-director",
  "consumer": "postfx-specialist",
  "objective": "Compress the broad sun-shot glare while preserving a compact hot source, readable silhouettes, lantern segmentation, and all established tonal gates.",
  "allowedScope": ["src/render/PostFX.js"],
  "prohibitedChanges": ["Do not edit Sky.js, Lighting.js, cinematic pose, materials, or global product criteria.", "Do not remove the sun or broadly darken every frame to satisfy one region."],
  "inputs": ["shots/review-r14.json", "shots/phone-sun-r14base.png", "shots/phone-hero-r14base.png", "shots/phone-torii-r14base.png", "HANDOFF.md god-ray disproof and open-item sections"],
  "outputs": ["Evidence-backed PostFX.js repair", "Exact pre/post prediction for the critic's 700x700 >90% luma coverage", "Coordinator-ready risk summary"],
  "affectedInterfaces": ["PostFX bloom/god-ray/filmic composite", "All review-frame histograms"],
  "dependencies": ["R13-ROUND", "R9-TONE-001"],
  "invariants": ["Compact sun core remains visible", "Hero and torii p99.9 remain >235", "All five p0.1 remain <15", "No external assets", "No per-frame allocation"],
  "assumptions": ["The critic's measured region is a reliable symptom; the owning post term must be proved by same-frame ablation before tuning."],
  "unresolvedQuestions": ["How much of the 38.1% high-luma population comes from bloom, god rays, or the base composite?"],
  "acceptanceCriteria": ["R14-ROUND-001", "R9-TONE-001"],
  "testsRequired": ["Same-frame term ablation or deterministic evaluator", "node --check src/render/PostFX.js", "npm run build", "Coordinator-owned coherent phone/MEDIUM recapture and hostile review"],
  "risks": ["Bloom/god-ray changes affect every frame", "Reducing glare can make the sun look pasted on", "A global shoulder change can consume the hero white-gate margin"],
  "rollback": "Restore src/render/PostFX.js from 04b552da83f3f17a9f270bbb739b3d2f610def86.",
  "status": "verified"
}
